"No","契約方式","案件番号","案件名称","発注所属","公開日","開札予定日時"
"1","一般競争入札（条件付き）/最低価格","20200055226","【条件付き】有田中央高等学校エアーコンディショナー講義室","有田地振総務県民課","令和2年08月07日 令和2年08月26日 14:00","令和2年08月07日 令和2年08月26日 14:00"
"2","一般競争入札（条件付き）/最低価格","20200055239","【条件付き】有田中央高等学校エアーコンディショナー選択教室","有田地振総務県民課","令和2年08月07日 令和2年08月26日 16:00","令和2年08月07日 令和2年08月26日 16:00"
"3","一般競争入札（条件付き）/最低価格","20200055148","危機管理・消防課　公用車（防災指揮車）","総務事務集中課","令和2年08月03日 令和2年08月21日 11:00","令和2年08月03日 令和2年08月21日 11:00"
"4","一般競争入札(WTO)/最低価格","20200054886","和歌山県立高等学校学習者用コンピュータ","総務事務集中課","令和2年07月31日 令和2年08月21日 10:00","令和2年07月31日 令和2年08月21日 10:00"
"5","一般競争入札（条件付き）/最低価格","20200055033","普通旋盤","総務事務集中課","令和2年07月31日 令和2年08月21日 13:30","令和2年07月31日 令和2年08月21日 13:30"
"6","一般競争入札（条件付き）/最低価格","20200055083","立てフライス盤","総務事務集中課","令和2年07月31日 令和2年08月21日 14:00","令和2年07月31日 令和2年08月21日 14:00"
