"No","契約方式","案件番号","案件名称","発注所属","公開日","開札予定日時"
"1","一般競争入札（条件付き）/最低価格","20210060449","火災性状トレーニングボックス","総務事務集中課","令和3年05月14日 令和3年05月28日 10:00","令和3年05月14日 令和3年05月28日 10:00"
"2","一般競争入札（条件付き）/最低価格","20210060481","レーザーラジアル","総務事務集中課","令和3年05月14日 令和3年05月28日 11:00","令和3年05月14日 令和3年05月28日 11:00"
"3","一般競争入札（条件付き）/最低価格","20210060078","卓上型近赤外計測器","総務事務集中課","令和3年05月11日 令和3年05月25日 10:00","令和3年05月11日 令和3年05月25日 10:00"
"4","一般競争入札（条件付き）/最低価格","20210060264","農林水産総務課　小型トラック","総務事務集中課","令和3年05月07日 令和3年05月21日 10:00","令和3年05月07日 令和3年05月21日 10:00"
"5","一般競争入札（条件付き）/最低価格","20210060234","養鶏研究所　バタリーブルーダー","日高地振総務県民課","令和3年05月06日 令和3年05月21日 10:00","令和3年05月06日 令和3年05月21日 10:00"
