"No","契約方式","案件番号","案件名称","発注所属","公開日","開札予定日時"
"1","一般競争入札（条件付き）/最低価格","20180041989","森林整備課　乗用自動車　１８００ＣＣクラス　５ドア（５人乗り　ガソリン車）４ＷＤ","総務事務集中課","平成30年09月26日","平成30年10月11日 14:00"
"2","一般競争入札（条件付き）/最低価格","20180042022","平成３０年度　塩化カルシウム　単価契約","伊都地振総務県民課","平成30年09月26日","平成30年10月11日 14:00"
"3","一般競争入札（条件付き）/最低価格","20180042032","イオンクロマトグラフ","総務事務集中課","平成30年09月26日","平成30年10月11日 11:00"
"4","一般競争入札（条件付き）/最低価格","20180041995","タクシーメーター装置検査用合否自動判定器","総務事務集中課","平成30年09月21日","平成30年10月05日 10:00"
"5","一般競争入札（条件付き）/最低価格","20180041267","田辺産業技術専門学院　トリプルテスター","西牟地振総務県民課","平成30年09月20日","平成30年10月04日 13:30"
"6","一般競争入札（条件付き）/最低価格","20180041268","田辺産業技術専門学院　エアーコンプレッサー","西牟地振総務県民課","平成30年09月20日","平成30年10月04日 13:50"
"7","一般競争入札（条件付き）/最低価格","20180041269","田辺産業技術専門学院　ヘッドライトテスター","西牟地振総務県民課","平成30年09月20日","平成30年10月04日 14:10"
