"No","契約方式","案件番号","案件名称","発注所属","公開日","開札予定日時"
"1","一般競争入札（条件付き）/最低価格","20190048720","森林整備課　軽乗用自動車","総務事務集中課","令和1年09月10日 令和1年09月26日 13:30","令和1年09月10日 令和1年09月26日 13:30"
"2","一般競争入札（条件付き）/最低価格","20190048729","生涯学習課　乗用自動車","総務事務集中課","令和1年09月10日 令和1年09月26日 14:30","令和1年09月10日 令和1年09月26日 14:30"
"3","一般競争入札（条件付き）/最低価格","20190048503","農林水産総務課　乗用車（ステーションワゴン）","総務事務集中課","令和1年09月04日 令和1年09月19日 10:00","令和1年09月04日 令和1年09月19日 10:00"
"4","（中止） 一般競争入札（条件付き）/最低価格","※中止理由等はこちらをご覧ください。 20190048527","※中止理由等はこちらをご覧ください。","総務事務集中課","令和1年08月30日 令和1年09月13日 13:30","令和1年08月30日 令和1年09月13日 13:30"
"5","（中止） 一般競争入札(WTO)/最低価格","※中止理由等はこちらをご覧ください。 20190048173","※中止理由等はこちらをご覧ください。","総務事務集中課","令和1年08月23日 令和1年10月04日 11:00","令和1年08月23日 令和1年10月04日 11:00"
