"No","契約方式","案件番号","案件名称","発注所属","公開日","開札予定日時"
"1","一般競争入札（条件付き）/最低価格","20180041706","平成３０年度秋特別展「西行—紀州に生まれ、紀州をめぐる—」展覧会図録","総務事務集中課","平成30年08月30日","平成30年09月12日 10:00"
"2","一般競争入札（条件付き）/最低価格","20180041628","車載式小型凍結防止剤散布機","東牟地振総務県民課","平成30年08月28日","平成30年09月11日 10:00"
"3","一般競争入札（条件付き）/最低価格","20180041486","県営住宅火災警報器取替１","総務事務集中課","平成30年08月22日","平成30年09月05日 14:00"
"4","一般競争入札（条件付き）/最低価格","20180040872","【条件付き一般競争入札】和歌山県立たちばな支援学校事務机購入（たちばな支援）","有田地振総務県民課","平成30年08月21日","平成30年08月31日 14:00"
"5","（中止） 一般競争入札（条件付き）/最低価格","※中止理由等はこちらをご覧ください。 20180041345","※中止理由等はこちらをご覧ください。","東牟地振総務県民課","平成30年08月21日","平成30年09月04日 10:00"
"6","一般競争入札（条件付き）/最低価格","20180041290","火災警報機（日高振興局建設部管内県営住宅）","日高地振総務県民課","平成30年08月13日","平成30年08月31日 10:30"
"7","一般競争入札（条件付き）/最低価格","20180041304","高精度画像入力装置","総務事務集中課","平成30年08月10日","平成30年08月31日 11:00"
"8","一般競争入札（条件付き）/最低価格","20180041313","ＩｏＴ用情報収集装置","総務事務集中課","平成30年08月10日","平成30年08月31日 11:30"
